[
  {
    "TRAN-ID": "0000000000683580",
    "TRAN-TYPE-CD": "01",
    "TRAN-CAT-CD": 1,
    "TRAN-SOURCE": "POS TERM",
    "TRAN-DESC": "Purchase at Abshire-Lowe",
    "TRAN-AMT": 504.77,
    "TRAN-MERCHANT-ID": 800000000,
    "TRAN-MERCHANT-NAME": "Abshire-Lowe",
    "TRAN-MERCHANT-CITY": "North Enoshaven",
    "TRAN-MERCHANT-ZIP": "72112",
    "TRAN-CARD-NUM": "4859452612877065",
    "TRAN-ORIG-TS": "2022-06-10 19:27:53.000000",
    "TRAN-PROC-TS": ""
  },
  {
    "TRAN-ID": "0000000001774260",
    "TRAN-TYPE-CD": "03",
    "TRAN-CAT-CD": 1,
    "TRAN-SOURCE": "OPERATOR",
    "TRAN-DESC": "Return item at Nitzsche, Nicolas and Lowe",
    "TRAN-AMT": -919.0,
    "TRAN-MERCHANT-ID": 800000000,
    "TRAN-MERCHANT-NAME": "Nitzsche, Nicolas and Lowe",
    "TRAN-MERCHANT-CITY": "Fidelshire",
    "TRAN-MERCHANT-ZIP": "53378",
    "TRAN-CARD-NUM": "0927987108636232",
    "TRAN-ORIG-TS": "2022-06-10 19:27:53.000000",
    "TRAN-PROC-TS": ""
  },
  {
    "TRAN-ID": "0000000006292564",
    "TRAN-TYPE-CD": "01",
    "TRAN-CAT-CD": 1,
    "TRAN-SOURCE": "POS TERM",
    "TRAN-DESC": "Purchase at Ernser, Roob and Gleason",
    "TRAN-AMT": 67.88,
    "TRAN-MERCHANT-ID": 800000000,
    "TRAN-MERCHANT-NAME": "Ernser, Roob and Gleason",
    "TRAN-MERCHANT-CITY": "North Makenziemouth",
    "TRAN-MERCHANT-ZIP": "78487-7965",
    "TRAN-CARD-NUM": "6009619150674526",
    "TRAN-ORIG-TS": "2022-06-10 19:27:53.000000",
    "TRAN-PROC-TS": ""
  },
  {
    "TRAN-ID": "0000000009101861",
    "TRAN-TYPE-CD": "01",
    "TRAN-CAT-CD": 1,
    "TRAN-SOURCE": "POS TERM",
    "TRAN-DESC": "Purchase at Guann LLC",
    "TRAN-AMT": 281.77,
    "TRAN-MERCHANT-ID": 800000000,
    "TRAN-MERCHANT-NAME": "Guann LLC",
    "TRAN-MERCHANT-CITY": "South Lynn",
    "TRAN-MERCHANT-ZIP": "51508-9166",
    "TRAN-CARD-NUM": "8040580410348680",
    "TRAN-ORIG-TS": "2022-06-10 19:27:53.000000",
    "TRAN-PROC-TS": ""
  },
  {
    "TRAN-ID": "0000000010142252",
    "TRAN-TYPE-CD": "01",
    "TRAN-CAT-CD": 1,
    "TRAN-SOURCE": "POS TERM",
    "TRAN-DESC": "Purchase at Kertzmann-Schoen",
    "TRAN-AMT": 454.66,
    "TRAN-MERCHANT-ID": 800000000,
    "TRAN-MERCHANT-NAME": "Kertzmann-Schoen",
    "TRAN-MERCHANT-CITY": "East Eulahstad",
    "TRAN-MERCHANT-ZIP": "98754-1089",
    "TRAN-CARD-NUM": "5656830544981216",
    "TRAN-ORIG-TS": "2022-06-10 19:27:53.000000",
    "TRAN-PROC-TS": ""
  },
  {
    "TRAN-ID": "0000000010229018",
    "TRAN-TYPE-CD": "01",
    "TRAN-CAT-CD": 1,
    "TRAN-SOURCE": "POS TERM",
    "TRAN-DESC": "Purchase at Gislason-Medhurst",
    "TRAN-AMT": 849.99,
    "TRAN-MERCHANT-ID": 800000000,
    "TRAN-MERCHANT-NAME": "Gislason-Medhurst",
    "TRAN-MERCHANT-CITY": "Colleenburgh",
    "TRAN-MERCHANT-ZIP": "23712-2080",
    "TRAN-CARD-NUM": "7379335634661142",
    "TRAN-ORIG-TS": "2022-06-10 19:27:53.000000",
    "TRAN-PROC-TS": ""
  },
  {
    "TRAN-ID": "0000000016259484",
    "TRAN-TYPE-CD": "03",
    "TRAN-CAT-CD": 1,
    "TRAN-SOURCE": "OPERATOR",
    "TRAN-DESC": "Return item at Sipes Inc",
    "TRAN-AMT": -56.77,
    "TRAN-MERCHANT-ID": 800000000,
    "TRAN-MERCHANT-NAME": "Sipes Inc",
    "TRAN-MERCHANT-CITY": "Emilioside",
    "TRAN-MERCHANT-ZIP": "93329",
    "TRAN-CARD-NUM": "4011500891777367",
    "TRAN-ORIG-TS": "2022-06-10 19:27:53.000000",
    "TRAN-PROC-TS": ""
  },
  {
    "TRAN-ID": "0000000017874199",
    "TRAN-TYPE-CD": "01",
    "TRAN-CAT-CD": 1,
    "TRAN-SOURCE": "POS TERM",
    "TRAN-DESC": "Purchase at Legros Group",
    "TRAN-AMT": 373.66,
    "TRAN-MERCHANT-ID": 800000000,
    "TRAN-MERCHANT-NAME": "Legros Group",
    "TRAN-MERCHANT-CITY": "Carmeloborough",
    "TRAN-MERCHANT-ZIP": "34849-5127",
    "TRAN-CARD-NUM": "8040580410348680",
    "TRAN-ORIG-TS": "2022-06-10 19:27:53.000000",
    "TRAN-PROC-TS": ""
  },
  {
    "TRAN-ID": "0000000019065428",
    "TRAN-TYPE-CD": "03",
    "TRAN-CAT-CD": 1,
    "TRAN-SOURCE": "OPERATOR",
    "TRAN-DESC": "Return item at Turcotte Group",
    "TRAN-AMT": -535.88,
    "TRAN-MERCHANT-ID": 800000000,
    "TRAN-MERCHANT-NAME": "Turcotte Group",
    "TRAN-MERCHANT-CITY": "Andrewfurt",
    "TRAN-MERCHANT-ZIP": "41346-3789",
    "TRAN-CARD-NUM": "6503535181795992",
    "TRAN-ORIG-TS": "2022-06-10 19:27:53.000000",
    "TRAN-PROC-TS": ""
  },
  {
    "TRAN-ID": "0000000021711604",
    "TRAN-TYPE-CD": "01",
    "TRAN-CAT-CD": 1,
    "TRAN-SOURCE": "POS TERM",
    "TRAN-DESC": "Purchase at Gleason, Shanahan and Reynolds",
    "TRAN-AMT": 416.11,
    "TRAN-MERCHANT-ID": 800000000,
    "TRAN-MERCHANT-NAME": "Gleason, Shanahan and Reynolds",
    "TRAN-MERCHANT-CITY": "Myrticeport",
    "TRAN-MERCHANT-ZIP": "21768-0823",
    "TRAN-CARD-NUM": "9501733721429893",
    "TRAN-ORIG-TS": "2022-06-10 19:27:53.000000",
    "TRAN-PROC-TS": ""
  },
  {
    "TRAN-ID": "0000000025430891",
    "TRAN-TYPE-CD": "01",
    "TRAN-CAT-CD": 1,
    "TRAN-SOURCE": "POS TERM",
    "TRAN-DESC": "Purchase at Beatty-Hessel",
    "TRAN-AMT": 94.33,
    "TRAN-MERCHANT-ID": 800000000,
    "TRAN-MERCHANT-NAME": "Beatty-Hessel",
    "TRAN-MERCHANT-CITY": "Simonisport",
    "TRAN-MERCHANT-ZIP": "52595",
    "TRAN-CARD-NUM": "3260763612337560",
    "TRAN-ORIG-TS": "2022-06-10 19:27:53.000000",
    "TRAN-PROC-TS": ""
  },
  {
    "TRAN-ID": "0000000028097268",
    "TRAN-TYPE-CD": "01",
    "TRAN-CAT-CD": 1,
    "TRAN-SOURCE": "POS TERM",
    "TRAN-DESC": "Purchase at Wolf, Cruickshank and Bode",
    "TRAN-AMT": 250.22,
    "TRAN-MERCHANT-ID": 800000000,
    "TRAN-MERCHANT-NAME": "Wolf, Cruickshank and Bode",
    "TRAN-MERCHANT-CITY": "Fritzchester",
    "TRAN-MERCHANT-ZIP": "20195-5156",
    "TRAN-CARD-NUM": "7094142751055551",
    "TRAN-ORIG-TS": "2022-06-10 19:27:53.000000",
    "TRAN-PROC-TS": ""
  },
  {
    "TRAN-ID": "0000000030755266",
    "TRAN-TYPE-CD": "01",
    "TRAN-CAT-CD": 1,
    "TRAN-SOURCE": "POS TERM",
    "TRAN-DESC": "Purchase at Ratke LLC",
    "TRAN-AMT": 829.55,
    "TRAN-MERCHANT-ID": 800000000,
    "TRAN-MERCHANT-NAME": "Ratke LLC",
    "TRAN-MERCHANT-CITY": "Brendenfort",
    "TRAN-MERCHANT-ZIP": "35302-6495",
    "TRAN-CARD-NUM": "3766281984155154",
    "TRAN-ORIG-TS": "2022-06-10 19:27:53.000000",
    "TRAN-PROC-TS": ""
  },
  {
    "TRAN-ID": "0000000032979555",
    "TRAN-TYPE-CD": "01",
    "TRAN-CAT-CD": 1,
    "TRAN-SOURCE": "POS TERM",
    "TRAN-DESC": "Purchase at Treutel-Leffler",
    "TRAN-AMT": 29.44,
    "TRAN-MERCHANT-ID": 800000000,
    "TRAN-MERCHANT-NAME": "Treutel-Leffler",
    "TRAN-MERCHANT-CITY": "New Nicolette",
    "TRAN-MERCHANT-ZIP": "65014-0045",
    "TRAN-CARD-NUM": "6509230362553816",
    "TRAN-ORIG-TS": "2022-06-10 19:27:53.000000",
    "TRAN-PROC-TS": ""
  },
  {
    "TRAN-ID": "0000000033688127",
    "TRAN-TYPE-CD": "01",
    "TRAN-CAT-CD": 1,
    "TRAN-SOURCE": "POS TERM",
    "TRAN-DESC": "Purchase at Schinner-Steuber",
    "TRAN-AMT": 958.99,
    "TRAN-MERCHANT-ID": 800000000,
    "TRAN-MERCHANT-NAME": "Schinner-Steuber",
    "TRAN-MERCHANT-CITY": "Schmittchester",
    "TRAN-MERCHANT-ZIP": "50777-5535",
    "TRAN-CARD-NUM": "3766281984155154",
    "TRAN-ORIG-TS": "2022-06-10 19:27:53.000000",
    "TRAN-PROC-TS": ""
  },
  {
    "TRAN-ID": "0000000040455859",
    "TRAN-TYPE-CD": "01",
    "TRAN-CAT-CD": 1,
    "TRAN-SOURCE": "POS TERM",
    "TRAN-DESC": "Purchase at Brekke, Bradtke and Weimann",
    "TRAN-AMT": 715.44,
    "TRAN-MERCHANT-ID": 800000000,
    "TRAN-MERCHANT-NAME": "Brekke, Bradtke and Weimann",
    "TRAN-MERCHANT-CITY": "Veummouth",
    "TRAN-MERCHANT-ZIP": "18481-5013",
    "TRAN-CARD-NUM": "1142167692878931",
    "TRAN-ORIG-TS": "2022-06-10 19:27:53.000000",
    "TRAN-PROC-TS": ""
  },
  {
    "TRAN-ID": "0000000043636099",
    "TRAN-TYPE-CD": "03",
    "TRAN-CAT-CD": 1,
    "TRAN-SOURCE": "OPERATOR",
    "TRAN-DESC": "Return item at Nader-Bayer",
    "TRAN-AMT": -945.66,
    "TRAN-MERCHANT-ID": 800000000,
    "TRAN-MERCHANT-NAME": "Nader-Bayer",
    "TRAN-MERCHANT-CITY": "Goyetteville",
    "TRAN-MERCHANT-ZIP": "35324",
    "TRAN-CARD-NUM": "2940139362300449",
    "TRAN-ORIG-TS": "2022-06-10 19:27:53.000000",
    "TRAN-PROC-TS": ""
  },
  {
    "TRAN-ID": "0000000051205286",
    "TRAN-TYPE-CD": "01",
    "TRAN-CAT-CD": 1,
    "TRAN-SOURCE": "POS TERM",
    "TRAN-DESC": "Purchase at Goodwin, Von and Krajcik",
    "TRAN-AMT": 649.33,
    "TRAN-MERCHANT-ID": 800000000,
    "TRAN-MERCHANT-NAME": "Goodwin, Von and Krajcik",
    "TRAN-MERCHANT-CITY": "Ericmouth",
    "TRAN-MERCHANT-ZIP": "03874",
    "TRAN-CARD-NUM": "7094142751055551",
    "TRAN-ORIG-TS": "2022-06-10 19:27:53.000000",
    "TRAN-PROC-TS": ""
  },
  {
    "TRAN-ID": "0000000054288996",
    "TRAN-TYPE-CD": "01",
    "TRAN-CAT-CD": 1,
    "TRAN-SOURCE": "POS TERM",
    "TRAN-DESC": "Purchase at Cremin and Sons",
    "TRAN-AMT": 502.66,
    "TRAN-MERCHANT-ID": 800000000,
    "TRAN-MERCHANT-NAME": "Cremin and Sons",
    "TRAN-MERCHANT-CITY": "Bartonside",
    "TRAN-MERCHANT-ZIP": "08677",
    "TRAN-CARD-NUM": "4534784102713951",
    "TRAN-ORIG-TS": "2022-06-10 19:27:53.000000",
    "TRAN-PROC-TS": ""
  },
  {
    "TRAN-ID": "0000000054727064",
    "TRAN-TYPE-CD": "01",
    "TRAN-CAT-CD": 1,
    "TRAN-SOURCE": "POS TERM",
    "TRAN-DESC": "Purchase at McDermott, Lockman and Weimann",
    "TRAN-AMT": 303.11,
    "TRAN-MERCHANT-ID": 800000000,
    "TRAN-MERCHANT-NAME": "McDermott, Lockman and Weimann",
    "TRAN-MERCHANT-CITY": "West Nedra",
    "TRAN-MERCHANT-ZIP": "05293",
    "TRAN-CARD-NUM": "1014086565224350",
    "TRAN-ORIG-TS": "2022-06-10 19:27:53.000000",
    "TRAN-PROC-TS": ""
  },
  {
    "TRAN-ID": "0000000058866561",
    "TRAN-TYPE-CD": "01",
    "TRAN-CAT-CD": 1,
    "TRAN-SOURCE": "POS TERM",
    "TRAN-DESC": "Purchase at Blick-Rippin",
    "TRAN-AMT": 183.88,
    "TRAN-MERCHANT-ID": 800000000,
    "TRAN-MERCHANT-NAME": "Blick-Rippin",
    "TRAN-MERCHANT-CITY": "East Julien",
    "TRAN-MERCHANT-ZIP": "87157",
    "TRAN-CARD-NUM": "0500024453765740",
    "TRAN-ORIG-TS": "2022-06-10 19:27:53.000000",
    "TRAN-PROC-TS": ""
  },
  {
    "TRAN-ID": "0000000060921254",